Riktlinje nr ,URL ,Namn ,Beskrivning ,Prio ,Princip(er) ,Taggar,Senast uppdaterad: ,Status: 
163,https://webbriktlinjer.se/riktlinjer/163-erbjud-alternativ-till-rorelsestyrning/,Erbjud alternativ till rörelsestyrning,"Se till att funktioner som aktiveras genom att användaren till exempel skakar, vrider, rör vid eller viftar framför enheten kan stängas av. Funktionerna ska även kunna aktiveras på något annat sätt. 

<a href=""/files/2018/08/rorelsestyrning.png""><img src=""/files/2018/08/rorelsestyrning-300x287.png"" alt=""Ovan: vridning av mobil medför förändring från läge 1 till läge 2. Nedan: Klick på knapp ger samma förändring."" width=""300"" height=""287"" class=""alignnone size-medium wp-image-19248"" /></a>

Detta hjälper personer som till exempel har enheten fastsatt vid en permobil eller som av någon annan anledning inte har fysisk möjlighet att utföra liknande rörelser. Det finns också användare som oavsiktligt kan aktivera den här typen av kontroller på grund av ofrivilliga skakningar (så kallad essentiell tremor) eller andra motoriska störningar.
",1,Tillgänglig,"DOS-lagen, Nytt i WCAG 2.1, rörelsestyrning",2018-11-28,na
164,https://webbriktlinjer.se/riktlinjer/164-meddelanden-som-inte-ar-fokus/,Se till att hjälpmedel kan presentera meddelanden som inte är i fokus,"Se till att de som använder tekniska hjälpmedel som exempelvis skärmläsare och förstoringsprogram kan göras uppmärksamma på viktiga meddelanden även om de presenteras utanför det område på sidan som användaren har i fokus. 
Ange med hjälp av attributen <code>role</code> eller <code>aria-live</code> var viktiga meddelanden kan förekomma, så får hjälpmedel kännedom om dessa och kan presentera dem för användaren vid ett lämpligt tillfälle.
Berörda användare riskerar annars att missa varningar, upplysningar och felmeddelanden. 
",1,Tillgänglig,"ajax, DOS-lagen, dynamisk, fokus, Nytt i WCAG 2.1, skärmläsare",2018-12-20,na
153,https://webbriktlinjer.se/riktlinjer/153-fungerar-oavsett-skarmens-riktning/,Se till att allt innehåll presenteras rätt oavsett skärmens riktning,"Alla människor har inte möjlighet att vrida på sin skärm. Vissa måste välja ett läge (stående eller liggande) och alltid använda detta, exempelvis med skärmen fast monterad på en rullstol. Skapa därför en design så att innehåll och funktioner är tillgängliga oavsett skärmens riktning. Då kan var och en välja det läge de föredrar.

<img src=""http://webbriktlinjer.se/files/2018/08/noun_Reading-1.png"" alt="""" width=""300"" height=""317"" class=""alignnone size-full wp-image-19311"" />
Det finns inget som hindrar att presentationen av innehållet och funktionerna skiljer sig åt mellan de båda lägena så länge innehållet är tillgängligt och funktionerna är åtkomliga och har normal funktion.

I riktlinjen finns undantag för när funktionaliteten är beroende av att användaren har skärmen i en viss riktning, till exempel ett pianoprogram där liggande läge är nödvändigt för att alla tangenterna ska få plats. Informera användaren om när en viss riktning av skärmen är nödvändigt.",1,Tillgänglig,"DOS-lagen, Nytt i WCAG 2.1, responsiv, skärmriktning",2018-11-28,ok
1,https://webbriktlinjer.se/riktlinjer/1-utga-fran-wcag-2-1-niva-aa/,Följ WCAG 2.1 nivå AA,"Följ Web Content Accessibility Guidelines (WCAG)  för att göra webbplatsen, innehållet och era tjänster tillgängliga för en bred mottagargrupp, inklusive personer med olika typer av funktionsnedsättningar. Detta maximerar värdet på de resurser ni lägger på webbutveckling och ökar samtidigt möjligheten för alla att delta i samhället på lika villkor.",Inaktiv,Tillgänglig,"Beställare, Förvaltning, Informatör, Nämner lag, Omfattande riktlinje, Språk, Tillgänglighet, Utvecklare, Utveckling, Webbplatsansvarig, Webbredaktör",2018-12-21,
1,https://webbriktlinjer.se/riktlinjer/1-utga-fran-wcag-2-1-niva-aa/,Följ WCAG 2.1 nivå AA,"Följ Web Content Accessibility Guidelines (WCAG)  för att göra webbplatsen, innehållet och era tjänster tillgängliga för en bred mottagargrupp, inklusive personer med olika typer av funktionsnedsättningar. Detta maximerar värdet på de resurser ni lägger på webbutveckling och ökar samtidigt möjligheten för alla att delta i samhället på lika villkor.",Inaktiv,Tillgänglig,"Beställare, Förvaltning, Informatör, Nämner lag, Omfattande riktlinje, Språk, Tillgänglighet, Utvecklare, Utveckling, Webbplatsansvarig, Webbredaktör",2018-12-21,
